{
  "version": 0,
  "architecture": "x86_64",
  "current_state": {
    "runtime_path": "boot_smoke_to_stack_memory_and_runtime_progression_to_halt",
    "halt_contract": "contracts/runtime_halt_contract.v0.json",
    "progression_stages_contract": "contracts/runtime_progression_stages.v0.json",
    "stack_initialization_evidence_contract": "contracts/stack_initialization_evidence_contract.v0.json",
    "stage": "MEMORY_INITIALIZATION_EVIDENCE",
    "implemented": true
  },
  "memory_definition": {
    "description": "Memory initialization means x86_64 boot code has zero-filled the entire contract-owned static region, completed the bounded write/read survival probe, and emitted governed evidence before returning to the halt path."
  },
  "controlled_region": {
    "source_file": "kernel/arch/x86_64/boot.asm",
    "section": ".bss",
    "start_symbol": "boot_memory_region",
    "end_symbol": "boot_memory_region_end",
    "size_bytes": 4096,
    "alignment_bytes": 4096,
    "allocation_mode": "static",
    "owner": "x86_64 boot memory evidence path",
        "lifetime": "entry_to_runtime_progression_and_halt"
  },
  "initialization_operation": {
    "operation": "zero_fill",
    "coverage": "entire_controlled_region",
    "fill_value": 0,
    "width_bytes": 8,
    "required_before_probe": true
  },
  "survival_probe": {
    "offset_bytes": 0,
    "write_width_bytes": 8,
    "sentinel_value": "0x4b4f5a4f4d454d31",
    "comparison": "exact_readback",
    "required_steps": [
      "write_sentinel",
      "read_sentinel",
      "compare_equal",
      "restore_fill_value"
    ],
    "required_before_marker": true
  },
  "marker_placement": {
    "reserved_marker": "KOZO_MEMORY_INIT_OK",
    "marker_status": "emitted",
    "marker_emitted": true,
    "required_after": [
      "controlled_region_zero_fill",
      "survival_probe_success"
    ],
    "required_before": "runtime_progression_entry",
    "emission_owner": "x86_64 boot memory evidence path"
  },
  "prerequisites": [
    "QEMU serial smoke evidence",
    "runtime halt contract",
    "runtime progression contract",
    "runtime progression stages contract",
    "stack initialization evidence",
    "stack initialization evidence contract"
  ],
  "evidence_requirements": [
    "controlled region symbols present in runtime source",
    "entire controlled region zero-filled by runtime code",
    "survival probe writes reads compares and restores the sentinel location",
    "KOZO_MEMORY_INIT_OK marker captured after successful initialization and probe",
    "memory initialization validator proof"
  ],
  "proof_boundary": [
    "evidence must come from runtime code, not scripts",
    "evidence must be captured through QEMU serial smoke or a successor governed runtime evidence path",
    "evidence must preserve the existing stack evidence marker sequence until a successor evidence path is accepted",
    "evidence must not replace the halt loop until runtime progression evidence permits it"
  ],
  "assumptions_enabled": [
    "bounded access to the contract-owned controlled region after the proven memory marker",
    "eligibility for runtime progression entry after separate progression path evidence"
  ],
  "assumptions_not_enabled": [
    "physical memory discovery",
    "paging enabled",
    "virtual memory management",
    "memory allocator behavior",
    "heap allocation",
    "complete Odin runtime readiness",
    "interrupt handling",
    "scheduler behavior",
    "userspace execution",
    "process model behavior",
    "VFS behavior",
    "device driver behavior",
    "syscall dispatch during boot",
    "production readiness"
  ],
  "future_validators": [
    "memory_initialization_evidence"
  ],
  "non_goals": [
    "general memory management",
    "physical memory discovery",
    "paging implementation",
    "virtual memory management",
    "memory allocator behavior",
    "heap allocation",
    "complete Odin runtime readiness",
    "runtime progression beyond the governed bounded call",
    "halt loop replacement",
    "interrupt handling",
    "scheduler behavior",
    "userspace execution",
    "process model behavior",
    "VFS behavior",
    "device driver behavior",
    "Linux compatibility",
    "POSIX compatibility",
    "production readiness"
  ]
}
